{
  "omst_type": "compatibility-vector",
  "vector_id": "incompatible-finality",
  "description": "EUR-Z cannot satisfy mandatory finality, atomicity, latency and liquidity requirements.",
  "input": { "settlement_intent": "examples/tokenized-bond-dvp/settlement-intent.json", "money_profile": "examples/tokenised-bond-dvp/eur-z.json" },
  "expected_status": "INCOMPATIBLE",
  "expected_reasons": ["FINALITY_MISMATCH", "ATOMICITY_UNAVAILABLE", "LATENCY_REQUIREMENT_UNMET", "LIQUIDITY_INSUFFICIENT"],
  "expected_properties": { "money_instrument": "EUR-Z" },
  "schema_version": "0.6.0",
  "ruleset_version": "omst-core-0.6",
  "x-note": "Synthetic vector. Not issuer, market or regulatory evidence."
}
